CODEVALUE,ID,STATUS,HIERARCHYLEVEL,PREFLABEL_FI,PREFLABEL_SV,PREFLABEL_EN,DESCRIPTION_FI,DESCRIPTION_SV,DESCRIPTION_EN,DEFINITION_FI,DEFINITION_SV,DEFINITION_EN,SHORTNAME,STARTDATE,ENDDATE
DRAFT,,VALID,,Luonnos,Utkast/skiss,Draft,Tietokohde on luonnos tai valmisteilla.,,Item is being drafted.,,,,,,
VALID,,VALID,,Voimassa oleva,Giltigt,VALID,,Tietokohde on hyväksytty ja sitä suositellaan käytettäväksi eikä sitä ole korvattu tai poistettu.,"Objektet har accepterats, är rekommenderat för användning och är inte ersatt eller inaktuellt.","The item has been accepted, is recommended for use, and has not been superseded or retired.",,,,,,
INVALID,,VALID,,Virheellinen,Inaktuell,InVALID,,Aiemmin hyväksytty tietokohde on todettu virheelliseksi. Yleensä tietokohde on korvattu korjatulla tietokohteella.,Det är beslutat att tidigare giltiga registerobjekt innehåller fel och är ogiltiga. Normalt skulle dessa vara ersatta med korrigerade objekt.,A decision has been made that the item is no longer recommended for use. It has not been superseded by another item.,,,,,,
SUPERSEDED,,VALID,,Korvattu,Ersatt,Superseded,Tietokohde on korvattu toisella tietokohteella eikä sitä suositella enää käytettäväksi.,Objektet har ersatts av annat objekt och är inte längre rekommenderat för användning.,The item has been superseded by another item and is no longer recommended for use.,,,,,,
RETIRED,,VALID,,Poistettu,Ogiltigt,Retired,Tietokohdetta ei suositella enää käytettäväksi eikä sitä ole korvattu toisella tietokohteella.,Det är beslutat att objektet inte längre är rekommenderat för användning. Det har inte ersatts av annat objekt.,"A decision has been made that a previously valid register item contains a substantial error and is inVALID,, and will normally have been replaced by a corrected item.",,,,,,